<?xml version="1.0" encoding="UTF-8"?>
<!ELEMENT texte (en-tete, corps)>
<!ELEMENT en-tete (titre, auteur, couverture, info_traitements, lien+)>
<!ELEMENT titre (#PCDATA)>
<!ELEMENT auteur (#PCDATA)>
<!ELEMENT lien (#PCDATA)>
<!ATTLIST lien
          langue CDATA #REQUIRED>
<!ELEMENT couverture EMPTY>
<!ATTLIST couverture
          chemin CDATA #REQUIRED>
<!ELEMENT info_traitements (but, mise_en_forme_par, email, date)>
<!ELEMENT but (#PCDATA)>
<!ELEMENT mise_en_forme_par (unCreateur+, NoBinome)>
<!ELEMENT unCreateur (#PCDATA)>
<!ELEMENT NoBinome (#PCDATA)>
<!ELEMENT email (#PCDATA)>
<!ELEMENT date (#PCDATA)>
<!ELEMENT corps (paragraphe+, image, paragraphe+)>
<!ELEMENT paragraphe (phrase+)>
<!ATTLIST paragraphe
          type CDATA #REQUIRED>
<!ELEMENT phrase (#PCDATA)>
<!ATTLIST phrase
          locuteur CDATA #REQUIRED
          modalite CDATA #REQUIRED
          langue CDATA #REQUIRED>
<!ELEMENT image EMPTY>
<!ATTLIST image
          chemin CDATA #REQUIRED>



